{
  "approval_id": "approval_20260404_063924_project_truth_update_app_next_step_v4",
  "patch_id": "patch_project_truth_update_app_next_step_v4",
  "decision": "approved",
  "approved_by": "human",
  "decided_at": "2026-04-04T06:39:24Z",
  "note": "Approved APP next-step update after execution refresh sync."
}
