{
  "approval_id": "approval_20260404_125928_live_order_gate_semantics_master_state_v7",
  "patch_id": "patch_live_order_gate_semantics_master_state_v7",
  "decision": "approved",
  "approved_by": "human",
  "decided_at": "2026-04-04T12:59:28Z",
  "note": "Approved live-order gate semantics for master_state.md."
}
